registration_number,title_en,start_date,end_date,status,owner_org
C-0000173,Canada in a Changing Climate,2023-06-05,2028-05-31,C,nrcan-rncan
DFO20261231-01,"Areas of Interest, Northern Shelf Bioregion (NSB) - Marine Protected Area Network",2022-09-06,2026-12-31,C,dfo-mpo
C-0000209,Canada-NS and Canada-NL Offshore Renewable Energy Regulations,2022-05-01,2025-10-30,C,nrcan-rncan
C-2024-07,Predictable and Efficient Processing and Assessment of Negligible-Risk and Low-Risk Activities,2024-07-09,2025-08-31,C,cer-rec
C-0001028,"Consultation on Carbon Dioxide and its associated end-use products, Proposed Re-evaluation Decision PRVD2025-03",2025-02-28,2025-05-29,C,hc-sc
