registration_number,title_en,start_date,end_date,status,owner_org
DFO20261231-01,"Areas of Interest, Northern Shelf Bioregion (NSB) - Marine Protected Area Network",2022-09-06,2028-12-31,C,dfo-mpo
C-0000173,Canada in a Changing Climate,2023-06-05,2028-05-31,C,nrcan-rncan
DFO20261231-01,"Areas of Interest, Northern Shelf Bioregion (NSB) - Marine Protected Area Network",2022-09-06,2026-12-31,C,dfo-mpo
DFO202008-03,Northern Gulf Marine Protected Area (MPA) Project - Consultations Phase,2019-06-01,2026-03-31,C,dfo-mpo
C-311024,Creating Canada’s 6th  National Action Plan on Open Government,2025-02-06,2026-03-31,C,tbs-sct
DFO20251107,Great Slave Lake Integrated Fisheries Management Plan,2025-11-25,2026-03-01,C,dfo-mpo
