registration_number,title_en,start_date,end_date,status,owner_org
C-000067,Call for comments – Mobile reporting standard,2026-01-15,2026-03-16,O,crtc
C-0000134,"Updating the Community Plans for Field, B.C. and Lake Louise, Alberta",2026-02-10,2026-03-16,O,pc
C-0000102,General Regulations under the Canada National Marine Conservation Areas Act,2023-04-11,2026-03-15,O,pc
C-000144,Consultation on the possibility of introducing a domestic content requirement as part of the Clean Electricity investment tax credit and the Clean Technology investment tax credit,2026-02-13,2026-03-13,O,fin
C-0001120,"Consultation: Guidelines for Canadian Drinking Water Quality, Haloacetic Acids",2026-01-09,2026-03-13,O,hc-sc
C-0001131,"Consultation on acynonapyr and Kodama Miticide, Proposed Registration Decision PRD2026-03",2026-02-10,2026-03-12,O,hc-sc
1125,Regulations Amending the Motor Vehicle Safety Regulations (Theft Protection),2025-12-27,2026-03-11,O,tc
C-0000147,Public consultation on the West Coast Trail Unit and Pacific Rim National Park Reserve,2026-02-09,2026-03-10,C,pc
C-000221,Proposed amended livestock feed ingredient – Vitamin E acetate,2026-02-09,2026-03-09,O,cfia-acia
