registration_number,title_en,start_date,end_date,status,owner_org
C-2025-004,Potential regulatory amendments to the Valuation for Duty Regulations,2025-09-25,2026-10-25,P,cbsa-asfc
C-0033338,Consultation on proposed amendments to the Volatile Organic Compound (VOC) concentration limits for automotive refinishing products regulations,2025-09-22,2025-11-21,O,ec
C-0185,"Amendments to Directive No 11R3, Surplus Income Directive",2025-09-22,2025-10-22,P,ic
C-000150,Share your thoughts: Proposed changes to the Chronic Wasting Disease Control Program,2025-09-19,2025-10-24,O,cfia-acia
C-000191,Share your thoughts: Proposed amendments to the Susceptible species of aquatic animals list - Perkinsus olseni and Perkinsus marinus,2025-09-19,2025-11-18,O,cfia-acia
C0000588,Consulting Canadians on the operation of the Canada-United States-Mexico Agreement (CUSMA),2025-09-19,2025-11-03,O,dfatd-maecd
