registration_number,title_en,start_date,end_date,status,owner_org
C-0255,Consultation on Level 1 and 2 Electric Vehicle Supply Equipment (EVSE) Inspection Specifications and Procedures,2026-06-08,2026-08-03,P,ic
C-0276,Consultation on Electric Vehicle Supply Equipment (EVSE) Type-Approval Specifications,2026-06-08,2026-08-03,P,ic
C-0285,Consultation on Revisions to the Framework Relating to Transfers and Subordinate Licensing of Spectrum Licences for Terrestrial Services,2026-06-04,2026-10-08,P,ic
DFO20251107,Great Slave Lake Integrated Fisheries Management Plan,2026-06-01,2026-10-01,P,dfo-mpo
687,Electric Vehicle Safety,2026-06-01,2026-07-31,P,tc
