registration_number,title_en,start_date,end_date,status,owner_org
C-2025-004,Potential regulatory amendments to the Valuation for Duty Regulations,2025-11-10,2025-12-10,P,cbsa-asfc
C202504,"REGDOC-3.2.2, Indigenous Engagement",2025-11-10,2026-03-09,P,cnsc-ccsn
C-0185,"Amendments to Directive No 11R3, Surplus Income Directive",2025-11-10,2025-12-10,P,ic
1019,Canadian Marine Advisory Council - Fall 2025,2025-11-04,2025-11-06,P,tc
C-2025-001,Administrative Monetary Penalty System Review,2025-11-03,2025-12-19,P,cbsa-asfc
