registration_number,title_en,start_date,end_date,status,owner_org
C-000190,IPPC Member consultation on draft International Standards for Phytosanitary Measures and specifications,2025-07-01,2025-09-30,P,cfia-acia
C-000192,Stakeholder Consultation on the Modernization of the Canadian Shellfish Sanitation Program (CSSP),2025-07-01,2025-12-01,P,cfia-acia
DFO20250606-02,Management plan for the Channel Darter - draft version for 60-day public consultation,2025-06-30,2025-08-30,P,dfo-mpo
C-0001055,Updated Proposal - Ministerial class exemption order for the exceptional importation and sale of certain foods for a special dietary purpose to mitigate a shortage or risk of a shortage,2025-06-30,2025-08-14,O,hc-sc
C-0001053,Consultation: Proposed Regulatory Amendments for Precursor Chemicals and Designated Devices,2025-06-28,2025-08-12,O,hc-sc
