registration_number,title_en,start_date,end_date,status,owner_org
C-100130,Consultations with Canadians with Disabilities on Accessibility (2025),2025-06-17,2025-06-26,P,cra-arc
C-2025-002,Acessibility External Questionnaire,2025-06-16,2025-07-13,P,cbsa-asfc
C-2025-003,Accesibility Internal Questionnaire,2025-06-16,2025-07-04,P,cbsa-asfc
C-0033299,"Evaluation by Environment and Climate Change Canada of the ongoing need for the Emergency Order for the Protection of the Western Chorus Frog (La Prairie, Candiac, Saint-Philippe)",2025-06-14,2025-09-12,O,ec
C-0000142,"Obadjiwan-Fort-Témiscamingue National Historic Site Draft Management Plan, 2025",2025-06-14,2025-07-14,O,pc
