registration_number,title_en,start_date,end_date,status,owner_org
C00112,Public engagement on how to strengthen federal leadership in emergency management,2025-11-28,2026-03-27,O,ps-sp
C-0001134,"Consultation on Permitting Pesticide Application by Remotely Piloted Aircraft Systems (RPAS; commonly known as drones) for Products Currently Registered for Aerial Application, Regulatory Proposal PRO2026-01",2026-02-23,2026-03-25,O,hc-sc
C-0001124,Consultation: Guidance on asbestos in drinking water,2026-01-23,2026-03-24,O,hc-sc
DFO20240709-01,"Recovery Strategy for the Mountain Sucker (Catostomus platyrhynchus), Milk River populations, in Canada",2025-12-15,2026-03-23,O,dfo-mpo
C-0001116,Consultation: Modernizing the framework for clinical trials,2025-12-20,2026-03-20,O,hc-sc
