registration_number,title_en,start_date,end_date,status,owner_org
C-0261,"Amendments to Superintendent's directives relating to cybersecurity guidelines, minimum requirements and measures for the Licensed Insolvency Trustee community",2025-12-12,2026-01-12,P,ic
DFO20251113,Newfoundland and Labrador Aquatic Invasive Species (AIS) Advisory Committee,2025-12-10,2025-12-10,P,dfo-mpo
DFO20251107-03,Clyde River Article 16 Options Summary Meeting,2025-12-10,2025-12-11,O,dfo-mpo
cta-otc-2025-4,Consultation on commercial market factors to be considered in determining fair and reasonable interswitching rates,2025-12-08,2026-04-07,O,cta-otc
C-0001109,"Consultation on 2-phenethyl propionate, nuranone, geraniol, eugenol, and Japanese Beetle Trap Refill, Proposed Registration Decision PRD2025-14",2025-12-05,2026-01-04,O,hc-sc
C-0001110,"Consultation on formic acid and FENNOSURF 600-C, Proposed Registration Decision PRD2025-16",2025-12-05,2026-01-04,O,hc-sc
DFO20251107-02,Pond Inlet Article 16 Options Summary Meeting,2025-12-04,2025-12-05,O,dfo-mpo
C-2025-004,Potential regulatory amendments to the Valuation for Duty Regulations,2025-12-03,2026-01-23,O,cbsa-asfc
