registration_number,title_en,start_date,end_date,status,owner_org
C-0001053,Consultation: Proposed Regulatory Amendments for Precursor Chemicals and Designated Devices,2025-06-28,2025-08-12,O,hc-sc
1071,Changing the Saskatoon International Airport Zoning Regulations,2025-06-11,2025-08-11,O,tc
C-000173,Share your thoughts: Proposed amended livestock feed ingredients – Miscellaneous changes to the Canadian Feed Ingredients Table,2025-07-09,2025-08-08,O,cfia-acia
C-000193,"Share your thoughts: Proposed modified livestock feed ingredient –L-lysine, L-lysine monohydrochloride and L-lysine solution",2025-07-09,2025-08-08,O,cfia-acia
C-000194,Share your thoughts: Proposed new livestock feed ingredient –Saponified marigold and paprika oleoresin,2025-07-09,2025-08-08,O,cfia-acia
C-000195,Share your thoughts: Proposed modified livestock feed ingredient –Vitamin E acetate,2025-07-09,2025-08-08,O,cfia-acia
C-000196,Share your thoughts: Proposed new and amended livestock feed ingredients – Eugenol and vanillin,2025-07-09,2025-08-08,O,cfia-acia
89634,Josephburg Condensate Fractionation Project - Public comments and information sessions on the summary of the initial project description,2025-07-17,2025-08-06,O,iaac-aeic
C202501,"Discussion paper DIS-25-01, Regulatory Readiness for Fusion",2024-06-05,2025-08-04,O,cnsc-ccsn
