registration_number,title_en,start_date,end_date,status,owner_org
C-0001120,"Consultation: Guidelines for Canadian Drinking Water Quality, Haloacetic Acids",2026-01-09,2026-03-13,O,hc-sc
C-0001131,"Consultation on acynonapyr and Kodama Miticide, Proposed Registration Decision PRD2026-03",2026-02-10,2026-03-12,O,hc-sc
1125,Regulations Amending the Motor Vehicle Safety Regulations (Theft Protection),2025-12-27,2026-03-11,O,tc
C-0000147,Public consultation on the West Coast Trail Unit and Pacific Rim National Park Reserve,2026-02-09,2026-03-10,O,pc
C-000221,Proposed amended livestock feed ingredient – Vitamin E acetate,2026-02-09,2026-03-09,O,cfia-acia
C00121,Proposed Regulations Amending the Firearms Licences Regulations - licence ineligibility and revocation - protection orders,2026-02-03,2026-03-04,O,ps-sp
C-VAC0062,National Women Veterans Day,2026-02-25,2026-03-03,C,vac-acc
