registration_number,title_en,start_date,end_date,status,owner_org
DFO20251113,Newfoundland and Labrador Aquatic Invasive Species (AIS) Advisory Committee,2025-12-10,2025-12-10,P,dfo-mpo
DFO20251107-03,Clyde River Article 16 Options Summary Meeting,2025-12-10,2025-12-11,O,dfo-mpo
DFO20251107-02,Pond Inlet Article 16 Options Summary Meeting,2025-12-04,2025-12-05,O,dfo-mpo
C-2025-004,Potential regulatory amendments to the Valuation for Duty Regulations,2025-12-03,2026-01-23,O,cbsa-asfc
C-0001108,Consultation: Proposed new requirements for lithium-ion batteries and consumer products containing lithium-ion batteries under the Canada Consumer Product Safety Act,2025-12-02,2026-02-14,O,hc-sc
DFO20250606-02,Management plan for the Channel Darter (St.Lawrence population),2025-12-01,2026-01-31,P,dfo-mpo
DFO20251106,Fish and Fish Habitat Restoration Priorities for Lake Ontario,2025-12-01,2026-03-31,O,dfo-mpo
1098,Commercial Air Services Standards Omnibus Package,2025-12-01,2026-02-01,P,tc
