registration_number,title_en,start_date,end_date,status,owner_org
C-0001059,"Consultation on chlorantraniliprole, Proposed Maximum Residue Limit PMRL2025-11",2025-07-22,2025-10-05,O,hc-sc
C-0001060,"Consultation on fenazaquin, Proposed Maximum Residue Limit PMRL2025-10",2025-07-22,2025-10-05,O,hc-sc
C-0001061,"Consultation on cyantraniliprole, Proposed Maximum Residue Limit PMRL2025-09",2025-07-22,2025-10-05,O,hc-sc
C-000190,IPPC Member consultation on draft International Standards for Phytosanitary Measures and specifications,2025-07-01,2025-09-30,O,cfia-acia
C-0001048,Release of draft (Step 2) ICH Guideline E21: Inclusion of Pregnant and Breastfeeding Individuals in Clinical Trials,2025-06-27,2025-09-25,C,hc-sc
C-0001049,Release of draft (Step 2) ICH Guideline E20: Adaptive Clinical Trials,2025-06-27,2025-09-25,C,hc-sc
C-0001050,Release of draft (Step 2) ICH Guideline M4Q(R2): Common Technical Document (CTD)-Quality,2025-06-27,2025-09-25,C,hc-sc
