registration_number,title_en,start_date,end_date,status,owner_org
DFO20251107-02,Pond Inlet Article 16 Options Summary Meeting,2025-12-04,2025-12-05,O,dfo-mpo
C-000066,Share your thoughts about improving the resiliency of telecommunications networks and reliability of telecommunications services,2025-09-04,2025-12-03,O,crtc
C-000205,Share your thoughts: Options for emerald ash borer management in Canada,2025-09-29,2025-11-30,O,cfia-acia
C-0000209,Canada-NS and Canada-NL Offshore Renewable Energy Regulations,2022-05-01,2025-11-30,O,nrcan-rncan
C-0001095,"Consultation on rectified clove leaf oil and DECCO 070 EC, Proposed Registration Decision PRD2025-13",2025-10-28,2025-11-27,C,hc-sc
C-0001076,"Consultation on cyclobutrifluram, Proposed Maximum Residue Limit PMRL2025-19",2025-09-12,2025-11-26,C,hc-sc
C-0001078,"Consultation on fluoxapiprolin, Proposed Maximum Residue Limit PMRL2025-20",2025-09-12,2025-11-26,C,hc-sc
C-0033287,"Consultation document on Phase 1 PFAS prohibition: Risk management of PFAS, excluding fluoropolymers, not currently regulated in firefighting foams",2025-09-26,2025-11-25,C,ec
C-0033343,"Consultation Document on Phase 1 of the Risk Management of Per- and Polyfluoroalkyl Substances (PFAS), Excluding Fluoropolymers: Prohibition of the Use of PFAS, not Currently Regulated, in Firefighting Foams",2025-09-26,2025-11-25,C,ec
