registration_number,title_en,start_date,end_date,status,owner_org
C-0000148,PROPOSED DEMOLITION OF THE PARKS CANADA UPPER HOT POOL RESIDENCE (BANFF UPPER HOT SPRINGS CARETAKER’S COTTAGE),2026-06-15,2026-07-15,O,pc
C-1235689,Regulations Amending Certain Regulations Made Under the Canada Labour Code (Personal Protective Equipment),2026-06-12,2026-07-13,O,esdc-edsc
DFO20260420-04,Raising of the Coop Wharf – Étang‑du‑Nord Harbour – Magdalen Islands,2026-06-10,2026-09-10,P,dfo-mpo
DFO20260420-05,Wharf 402 Reconstruction - Mont-Louis Harbour - Gaspésie,2026-06-10,2026-09-10,P,dfo-mpo
C-0001153,"Consultation on canola oil, garlic oil, capsaicin, related capsaicinoids, and Captiva Prime, Proposed Registration Decision PRD2026-10",2026-06-09,2026-07-09,O,hc-sc
C-0255,Consultation on Level 1 and 2 Electric Vehicle Supply Equipment (EVSE) Inspection Specifications and Procedures,2026-06-08,2026-08-03,O,ic
C-0276,Consultation on Electric Vehicle Supply Equipment (EVSE) Type-Approval Specifications,2026-06-08,2026-08-03,O,ic
