registration_number,title_en,start_date,end_date,status,owner_org
C-0001067,"Consultation on metamitron, Brevis 150 SC, and Brevis 15 SG, Proposed Registration Decision PRD2025-05",2025-08-08,2025-09-22,O,hc-sc
C-8,Engagement on renewing Canada’s National Financial Literacy Strategy,2025-09-12,2025-09-19,O,fcac-acfc
C-000186,Share your thoughts: Proposed changes to the Tables of Nutrient Guarantees and Conditions for Feed Labels,2025-08-15,2025-09-15,O,cfia-acia
C-0033329,Consultation on the proposed proposed Management plan for the Magdalen Islands Grasshopper (Melanoplus madeleineae),2025-07-17,2025-09-15,O,ec
C-0001058,"Consultation on revised procedures for the registration of pesticides for emergency use, Regulatory Proposal PRO2025-03",2025-07-16,2025-09-14,C,hc-sc
