registration_number,title_en,start_date,end_date,status,owner_org
cta-otc-2026-1,Lac‑Mégantic Bypass Consultation on Groupe Conseil UDA Report and CMQR’s response,2026-06-18,2026-06-29,O,cta-otc
C-0001140,"Consultation on famoxadone and its associated end-use product, Proposed Re-evaluation Decision PRVD2026-02",2026-03-31,2026-06-29,O,hc-sc
C-0033405,Risk Management Approach for the Alkyl Halides Group,2026-04-25,2026-06-24,O,ec
C-0033406,"Share your thoughts: Proposed updates to the Contraventions Regulations (CEPA, 1999 and MBCA, 1994)",2026-05-12,2026-06-24,O,ec
cta-otc-2025-4,Consultation on commercial market factors to be considered in determining fair and reasonable interswitching rates,2025-12-08,2026-06-19,C,cta-otc
